{
  "schemaVersion": 1,
  "release": "0.4.1",
  "sourceRevision": "1948b6e932f2780d7c2240a8ad9e9b47f4f90342",
  "riskDecision": "missing-p0-hardware-evidence",
  "rows": [
    {
      "id": "win-x64-amd-zen5-cpu",
      "hardwareClass": "AMD Ryzen 9 9950X3D",
      "os": "Windows 11 x64",
      "architecture": "x64",
      "backend": "CPU",
      "status": "DIRECT_L2",
      "supportClaim": false,
      "evidenceLevel": "L2_DIRECT_RUNTIME",
      "evidenceSummary": "Direct b10796 runtime smoke only; no packaged L4 attestation.",
      "releaseNotesDisclosed": true,
      "attestation": null
    },
    {
      "id": "win-x64-amd-zen2-cpu",
      "hardwareClass": "AMD Zen 2 CPU",
      "os": "Windows 11 x64",
      "architecture": "x64",
      "backend": "CPU",
      "status": "UNKNOWN",
      "supportClaim": false,
      "evidenceLevel": "NONE",
      "evidenceSummary": "No exact physical hardware evidence.",
      "releaseNotesDisclosed": true,
      "attestation": null
    },
    {
      "id": "win-x64-amd-zen4-cpu",
      "hardwareClass": "AMD Zen 4 CPU",
      "os": "Windows 11 x64",
      "architecture": "x64",
      "backend": "CPU",
      "status": "UNKNOWN",
      "supportClaim": false,
      "evidenceLevel": "NONE",
      "evidenceSummary": "No exact physical hardware evidence.",
      "releaseNotesDisclosed": true,
      "attestation": null
    },
    {
      "id": "win-x64-intel-sse42-cpu",
      "hardwareClass": "Intel pre-AVX2 CPU",
      "os": "Windows 10 or 11 x64",
      "architecture": "x64",
      "backend": "CPU",
      "status": "UNKNOWN",
      "supportClaim": false,
      "evidenceLevel": "NONE",
      "evidenceSummary": "No exact pre-AVX2 processor evidence.",
      "releaseNotesDisclosed": true,
      "attestation": null
    },
    {
      "id": "win-x64-intel-avx2-cpu",
      "hardwareClass": "Intel AVX2 CPU",
      "os": "Windows 10 or 11 x64",
      "architecture": "x64",
      "backend": "CPU",
      "status": "UNKNOWN",
      "supportClaim": false,
      "evidenceLevel": "NONE",
      "evidenceSummary": "No exact Intel AVX2 processor evidence.",
      "releaseNotesDisclosed": true,
      "attestation": null
    },
    {
      "id": "win-x64-nvidia-pascal-cuda12",
      "hardwareClass": "NVIDIA Pascal GPU",
      "os": "Windows 11 x64",
      "architecture": "x64",
      "backend": "CUDA 12.4",
      "status": "UNKNOWN",
      "supportClaim": false,
      "evidenceLevel": "NONE",
      "evidenceSummary": "Official artifact and vendor policy only; no exact product run.",
      "releaseNotesDisclosed": true,
      "attestation": null
    },
    {
      "id": "win-x64-nvidia-turing-cuda",
      "hardwareClass": "NVIDIA Turing GPU",
      "os": "Windows 11 x64",
      "architecture": "x64",
      "backend": "CUDA 12.4 and CUDA 13.3",
      "status": "UPSTREAM_ONLY",
      "supportClaim": false,
      "evidenceLevel": "UPSTREAM",
      "evidenceSummary": "Upstream CI class only; no Localmotive product run.",
      "releaseNotesDisclosed": true,
      "attestation": null
    },
    {
      "id": "win-x64-nvidia-ampere-cuda",
      "hardwareClass": "NVIDIA Ampere GPU",
      "os": "Windows 11 x64",
      "architecture": "x64",
      "backend": "CUDA 12.4 and CUDA 13.3",
      "status": "UPSTREAM_ONLY",
      "supportClaim": false,
      "evidenceLevel": "UPSTREAM",
      "evidenceSummary": "Upstream CI class only; no Localmotive product run.",
      "releaseNotesDisclosed": true,
      "attestation": null
    },
    {
      "id": "win-x64-nvidia-ada-cuda",
      "hardwareClass": "NVIDIA Ada GPU",
      "os": "Windows 11 x64",
      "architecture": "x64",
      "backend": "CUDA 12.4 and CUDA 13.3",
      "status": "UPSTREAM_ONLY",
      "supportClaim": false,
      "evidenceLevel": "UPSTREAM",
      "evidenceSummary": "Upstream CI class only; no Localmotive product run.",
      "releaseNotesDisclosed": true,
      "attestation": null
    },
    {
      "id": "win-x64-nvidia-blackwell-cuda",
      "hardwareClass": "NVIDIA RTX 5090",
      "os": "Windows 11 x64",
      "architecture": "x64",
      "backend": "CUDA 13.3",
      "status": "DIRECT_L2",
      "supportClaim": false,
      "evidenceLevel": "L2_DIRECT_RUNTIME",
      "evidenceSummary": "Direct b10796 runtime smoke only; no packaged L4 attestation.",
      "releaseNotesDisclosed": true,
      "attestation": null
    },
    {
      "id": "win-x64-nvidia-blackwell-vulkan",
      "hardwareClass": "NVIDIA RTX 5090",
      "os": "Windows 11 x64",
      "architecture": "x64",
      "backend": "Vulkan",
      "status": "DIRECT_L2",
      "supportClaim": false,
      "evidenceLevel": "L2_DIRECT_RUNTIME",
      "evidenceSummary": "Direct b10796 runtime smoke only; no packaged L4 attestation.",
      "releaseNotesDisclosed": true,
      "attestation": null
    },
    {
      "id": "win-x64-amd-rdna2-vulkan",
      "hardwareClass": "AMD RDNA 2 GPU",
      "os": "Windows 11 x64",
      "architecture": "x64",
      "backend": "Vulkan",
      "status": "UNKNOWN",
      "supportClaim": false,
      "evidenceLevel": "NONE",
      "evidenceSummary": "Artifact metadata only; no exact product run.",
      "releaseNotesDisclosed": true,
      "attestation": null
    },
    {
      "id": "win-x64-amd-rdna3-rocm",
      "hardwareClass": "AMD RDNA 3 GPU",
      "os": "Windows 11 x64",
      "architecture": "x64",
      "backend": "ROCm",
      "status": "UPSTREAM_FAILURE",
      "supportClaim": false,
      "evidenceLevel": "UPSTREAM",
      "evidenceSummary": "The reviewed upstream GPU CI failed; no exact product run.",
      "releaseNotesDisclosed": true,
      "attestation": null
    },
    {
      "id": "win-x64-amd-rdna4-rocm",
      "hardwareClass": "AMD RDNA 4 GPU",
      "os": "Windows 11 x64",
      "architecture": "x64",
      "backend": "ROCm",
      "status": "UPSTREAM_FAILURE",
      "supportClaim": false,
      "evidenceLevel": "UPSTREAM",
      "evidenceSummary": "The reviewed upstream GPU CI failed; no exact product run.",
      "releaseNotesDisclosed": true,
      "attestation": null
    },
    {
      "id": "win-x64-amd-rdna35-apu",
      "hardwareClass": "AMD Ryzen AI APU",
      "os": "Windows 11 x64",
      "architecture": "x64",
      "backend": "ROCm and Vulkan",
      "status": "UNKNOWN",
      "supportClaim": false,
      "evidenceLevel": "NONE",
      "evidenceSummary": "Vendor matrix only; no exact product run.",
      "releaseNotesDisclosed": true,
      "attestation": null
    },
    {
      "id": "win-x64-intel-xelp",
      "hardwareClass": "Intel Iris Xe",
      "os": "Windows 11 x64",
      "architecture": "x64",
      "backend": "Vulkan and OpenVINO",
      "status": "UPSTREAM_ONLY",
      "supportClaim": false,
      "evidenceLevel": "UPSTREAM",
      "evidenceSummary": "Upstream Intel CI and documentation only; no Localmotive product run.",
      "releaseNotesDisclosed": true,
      "attestation": null
    },
    {
      "id": "win-x64-intel-arc-alchemist",
      "hardwareClass": "Intel Arc A-series",
      "os": "Windows 11 x64",
      "architecture": "x64",
      "backend": "SYCL and Vulkan",
      "status": "UPSTREAM_ONLY",
      "supportClaim": false,
      "evidenceLevel": "UPSTREAM",
      "evidenceSummary": "Upstream A770 and Vulkan CI only; no Localmotive product run.",
      "releaseNotesDisclosed": true,
      "attestation": null
    },
    {
      "id": "win-x64-intel-arc-battlemage",
      "hardwareClass": "Intel Arc B-series",
      "os": "Windows 11 x64",
      "architecture": "x64",
      "backend": "SYCL and Vulkan",
      "status": "UNKNOWN",
      "supportClaim": false,
      "evidenceLevel": "NONE",
      "evidenceSummary": "Artifact and source evidence only; no exact product run.",
      "releaseNotesDisclosed": true,
      "attestation": null
    },
    {
      "id": "win-x64-clean-account",
      "hardwareClass": "no developer toolkits",
      "os": "Windows 11 x64",
      "architecture": "x64",
      "backend": "all shipped",
      "status": "L4_PASS",
      "supportClaim": true,
      "evidenceLevel": "L4_PRODUCT",
      "evidenceSummary": "Sandbox run 34108616687 PASS: NSIS install/launch/uninstall, MSI install/launch/uninstall, NSIS update from 0.4.0. Installer lifecycle only; no model inference in Sandbox.",
      "releaseNotesDisclosed": true,
      "attestation": "clean-account-lifecycle-0.4.1"
    }
  ]
}
